<!ELEMENT ETIQUETOTA ((ETIQUETA+))>
<!ELEMENT ETIQUETITA (#PCDATA)>
<!ELEMENT ETIQUETA ((ETIQUETITA+))>
<!ATTLIST ETIQUETA
	numero_etiquetitas (2 | 1) #IMPLIED
>
