<!DOCTYPE ETIQUETOTA SYSTEM "IMPLIED.dtd">
<ETIQUETOTA>
	<ETIQUETA numero_etiquetitas="1">
		<ETIQUETITA>
		
		</ETIQUETITA>
	</ETIQUETA>
	<ETIQUETA numero_etiquetitas="2">
		<ETIQUETITA>
		
		</ETIQUETITA>
		<ETIQUETITA>
		
		</ETIQUETITA>
	</ETIQUETA>
	
	<ETIQUETA>
		<ETIQUETITA></ETIQUETITA>
	</ETIQUETA>
</ETIQUETOTA>
